,title,no,ID,nick,content,date,like,dislike
4307,드로잉 레시피,6,(ksha****),귤,어어어어...ㅠㅠ 엄마 보고시퍼...ㅡㅜㅡㅠㅠㅠ,2020-08-23 23:17,4,0
4308,드로잉 레시피,6,(daat****),윤하,감성 흘른닷,2020-08-23 23:17,4,0
4309,드로잉 레시피,6,(ogpf****),,눈물아 ㅠㅠㅠㅠㅠㅠㅠㅠㅠ,2020-08-23 23:17,4,0
4310,드로잉 레시피,6,(acte****),도리,얼음을 뚫고 핀 복수초.. 눈 내리는 날 돌아가신 엄마.. 이제서야 은수에게 따듯한 햇살이 비추는군요.,2020-08-23 23:17,4,0
4311,드로잉 레시피,6,(jdrh****),키위새,맞아요 나이가 들었다고 다 괜찮아지는 것 도 시간이 다 해결해 준다는것도 어떨땐 아닌것 같아요.,2020-08-23 23:17,4,0
4312,드로잉 레시피,6,(aaca****),메리골드,해먹 정말 좋죠... 누워 있으면 나른하고 포근하고...,2020-08-23 23:17,4,0
4313,드로잉 레시피,6,(kar1****),둠둠이,엄마랑 다투고 쿠키로 계속 보는데 여러모로 힘들다보니 제가 위로받는거처럼 눈물이 계속 나요 훗날 후회하지않게 잘 해드려야는데 맘처럼 잘 안되는 제 자신이 밉네요 ㅠ,2020-08-23 23:17,4,0
4314,드로잉 레시피,6,(ear2****),파이리,힐링 그 자체... 이 밤에 눈물이 멈추질 않네요 ㅎㅎ 내일 출근해야하는데.. 저도 이겨내지 못해도 느는건 있겠죠? 좋은 작품 감사해요,2020-08-09 23:42,4,0
4315,드로잉 레시피,6,(nost****),ave,진짜 넘넘 좋다..,2020-08-09 23:42,4,0
4316,드로잉 레시피,6,(anjd****),KIMSO,따뜻합니다♡,2020-08-09 23:42,4,0
4317,드로잉 레시피,6,(wndu****),마시마로,정말 몽글몽글한 그림체와 글들이네요은수가 그린 꽃들이 가득한 그림더 보고싶어져요해먹이 꼬옥 안기는 기분을 들게하죠은수의 기분이 조금이라도 좋아졌으면 좋겠어요,2020-08-09 23:42,4,0
4318,드로잉 레시피,6,(gjwj****),쨔아앙쿨,"오늘도 바로 같은 아파트 단지 바로 옆 동에 사는 엄마가 손주들 좋아하는 과일 바리바리 싸들고 오셔가지고는 손주들한테 엄마 말 잘들어라, 내딸이니 고생시키지마라 하고 한참을 아이들과 놀아주다 가셨는데 만화 첫화부터 지금화까지 보다보니 알겠어요.. 손주가 이뻐서 놀아주러 오는게아니라.. 내 딸 조금이라도 고생 덜하라고, 조금이라도 힘듦을 덜어주려고 자주 오신다는걸... 내일은 엄마오면 살갑게 인사해야겠어요~ 남편도 있는데 왜 자주오나 말은 못하고 짜증낸 적 많았는데엄마한테 잘해야겠어요...",2020-08-09 23:42,4,0
4319,드로잉 레시피,6,(blue****),크류세,작가님..글을 읽으며 저도 모르게 흐르는 눈물에 당황하면서 닦다가 오열했어요..저는 21살에 어머니를 보내고 지금은 40대에요. 이나이가 되어서 내가 엄마가 되었어도 내 어머니가 한없이 그리워요.마지막날 함께 먹었던 콩국수를 지금도 먹지못하고 있을만큼요. 출산하는날 옆커텐의 산모가 친정엄마의 손을잡고 소리지르는 모습에 저는 그만 부러워서 울다가 첫아이를 낳았어요. 주절주절 말이 길어졌네요. 작가님작품은 홍차때부터 잘보고 있어요. 무심한듯 하지만 디테일한 감정표현과 모두가 주인공이 작품..늘 응원할께요!💕,2020-08-09 23:42,4,0
4320,드로잉 레시피,6,(jjyy****),쭈연,해먹은 누군가 안아주는 느낌이애요 은수도 엄마가 안아주는 느낌을 받고 위로가 됐으면 좋겠네요...ㅜㅜ,2020-08-09 23:42,4,0
4321,드로잉 레시피,6,(lnk5****),남쓰,우리엄마 멀쩡히 살아계시는데도 보고싶어졌어요....자취하는데...오늘 전화나드려서 수다나 잔뜩 떨어야겠어요....그런통화 엄마가좋아하는거 알면서도 자주못해드리데....ㅜ,2020-08-09 23:42,4,0
4322,드로잉 레시피,6,(dmsg****),아,ㅠㅠㅠㅠㅠㅠㅠ 뺑소니범 주거,2020-08-09 23:42,4,0
4323,드로잉 레시피,6,(reda****),한수경,아ㅜㅠ너무 맘아픈데ㅠㅠ,2020-08-09 23:42,4,0
4324,드로잉 레시피,6,(j_ke****),실버문티,10점 만점이 아닐 수가 없다 정말,2020-08-09 23:42,4,0
4325,드로잉 레시피,6,(koor****),바다의별,옆에서 자고있는 딸보면서 오래오래 곁에 있는엄마가 꼭 되주고싶은밤이네요ㅠㅠ,2020-08-09 23:42,4,0
4326,드로잉 레시피,6,(dlth****),thwjd0110,엄마가 평소랑 다르다는걸 직감한 부분부터 눈물이 바로 고였어요..엄마랑 같이 있는데도 엄마가 보고싶어요ㅎㅎ,2020-08-09 23:42,4,0
4327,드로잉 레시피,6,(jiwo****),송지우,엄마가 돌아가신게 뺑소니라니...,2020-08-09 23:42,4,0
4328,드로잉 레시피,6,(dmsq****),재욱은 나의 길,마음이 참 편안해지는 웹툰. 덩달아 저도 위로 받고 가는 기분이 드네요 ❤️,2020-08-09 23:42,4,0
4329,드로잉 레시피,6,(ye_j****),꼼꼼이누나,가슴이 따뜻해지면서도 아려오네요ㅠㅠ 갑작스런 엄마의 사고로 주인공이 얼마나 힘들었을까요... 석촌에서 주인공이 마음을 잘 치유받았으면 좋겠어요,2020-08-03 00:27,986,4
4330,드로잉 레시피,6,(1885****),밥이약,드라마 각 나오는데요♡할무니는 윤여정 배우님으로 해주세요 🙏 여주는 쌈마이웨이 송하윤 님 걸어봅니다,2020-08-03 00:27,986,4
4331,드로잉 레시피,6,(sun0****),거북선,보면 힐링되면서도 마음아프네요..진심으로 행복해졌으면 좋겠어요,2020-08-03 00:27,986,4
4332,드로잉 레시피,6,(tlsq****),룰루랄라,앗 첫댓글 저 베댓되나요??? 그나저나 넘 맘아프네여ㅠㅠ,2020-08-03 00:27,986,4
4333,드로잉 레시피,5,(fixs****),미음미음,아 삼각... ㅡㅡ;;;;;;,5일 전,0,0
4334,드로잉 레시피,5,(yxug****),yxu,돈가스....고래....,5일 전,0,0
4335,드로잉 레시피,5,(dkff****),woong,어렸을 때 진짜 귀엽닼ㅋㅋ 삐삐~,5일 전,0,0
4336,드로잉 레시피,5,(th11****),때히,액자 속 사진의 왕밤빵,5일 전,0,0
4337,드로잉 레시피,5,(fod4****),얼,너무 좋아요..,5일 전,0,0
4338,드로잉 레시피,5,(tuna****),참치100마리,𓃘𓃝𓃗𓃠𓃩𓃡𓃟𓃬𓃰𓃱𓃯𓃵𓃹𓃷𓃲𓅜𓅪𓅰𓆉𓆈𓅭𓅦𓄿𓆌𓆗𓆟𓆏𓆣𓆧𓆦𓆡𓃘𓃝𓃗𓃠𓃩𓃡𓃟𓃬𓃰𓃱𓃯𓃵𓃹𓃷𓃲,5일 전,0,0
4339,드로잉 레시피,5,(neve****),호석이두마리치킨직원,맛있게 먹으면 완성되는 그림...정말 멋진말인것 같아요,5일 전,0,0
4340,드로잉 레시피,5,(dbtl****),시원,설마 저 액자 무명화가가 그린 은수 엄마 초상화인건가..?,5일 전,0,0
4341,드로잉 레시피,5,(ging****),GingerKing,하악 ㅠㅠㅠㅠ 너무 설렌당,5일 전,0,0
4342,드로잉 레시피,5,(memm****),메밍,급배고픔!,5일 전,0,0
4343,드로잉 레시피,5,(wkdl****),캭캭캭,너무 이쁘다..,5일 전,0,0
4344,드로잉 레시피,5,(zdf1****),린린,몽글몽글,5일 전,0,0
4345,드로잉 레시피,5,(prin****),홍망이,정말 쿵쿵 기대되는 스토리,5일 전,0,0
4346,드로잉 레시피,5,(dvm6****),알새우칩,서로 엉뚱한 다른얘기를 하고 있지만 결국엔 같은 사람얘기 ㅋㅋ,5일 전,0,0
4347,드로잉 레시피,5,(ohna****),모히,리틀포레스트 보는것같다,5일 전,0,0
4348,드로잉 레시피,5,(gold****),정다운,내가 해준 음식 남기면 신경쓰이는데 주인공 ㅠㅠ,2020-08-30 22:23,5,0
4349,드로잉 레시피,5,(eyes****),,은수가 엄마가 차려준 음식 맛있게 먹을때도 그만큼 행복하다?여기서 울컥했어요.식당에서 웹툰보면서 밥먹다가 울뻔...ㅠ,2020-08-30 22:23,5,0
4350,드로잉 레시피,5,(hiia****),yeah,어머?!,2020-08-30 22:23,5,0
4351,드로잉 레시피,5,(choc****),방망이깎던여인,영화화 된다면 어쩐지 엄마역은 문소리가 어울릴거같아,2020-08-30 22:23,5,0
4352,드로잉 레시피,5,(kaiy****),kay,엄마랑 둘이 살고 또 엄청 각별한 사이여서 그런지 이 웹툰 보는데는 용기가 필요하군요..어릴때부터 항상 가장 무서워 하던 상황을 그린 웹툰이라...저는 엄마랑 같이 살고 있지만 상상만 해도 너무너무 무섭고 마음이 아파요.,2020-08-30 22:23,5,0
4353,드로잉 레시피,5,(wtsq****),물총새,그림체가 딱 🐶뭐 같네,2020-08-30 22:23,5,0
4354,드로잉 레시피,5,(uneo****),봄날의곰,괜히 봤네. 완결되면 볼 것을ㅜㅜ,2020-08-30 22:23,5,0
4355,드로잉 레시피,5,(podd****),지옥의퍼블리셔,"썸네일에 있는 아기염소에 홀려서 들어옴,,아기염소 빨리 나왔으면 좋겠다,,,",2020-08-30 22:23,5,0
4356,드로잉 레시피,5,(omlj****),ssun,아 힐링툰인데 설레기까지 하면 반칙 아닌가요?,2020-08-30 22:23,5,0
4357,드로잉 레시피,5,(soph****),Sophia,"영화 '리틀포레스트' 같은 느낌의 담백한 웹툰! 감성을 자극하는 작품, 너무 좋네요~~",2020-08-30 22:23,5,0
4358,드로잉 레시피,5,(iamp****),문성현,별점 태러하는 잼민이들은 꺼져라 보기싫으면 보지마 나도 니네 얼굴 보기 싫어,2020-08-30 22:23,5,0
4359,드로잉 레시피,5,(extr****),조디콘,그냥 아무생각없이 눈에 살짝 눈물이 맺힌다,2020-08-30 22:23,5,0
4360,드로잉 레시피,5,(girl****),풍류소녀,버스에서 옷준거 남자였구나 컷트머리 아주머니인줄,2020-08-30 22:23,5,0
4361,드로잉 레시피,5,(sinh****),신이,대사봐ㅠㅠㅠㅠㅠ 젓가락으로 그린 그림 ㅠㅠㅠㅠㅠㅜ,2020-08-30 22:23,5,0
4362,드로잉 레시피,5,(aram****),알랑,딸을 키우고있는데..제 젓가락으로 만든 그림 잘 먹어주면 완성되는 그림..엄마 마음들은 다 같나봐요^^,2020-08-30 22:23,5,0
4363,드로잉 레시피,5,(lhl5****),비공개,이 웹툰은 사람들이 격없어서 너무 낯설다... 현대인 감성 충만한 나는 좀 적응이 안됨.,2020-08-18 10:31,2,2
4364,드로잉 레시피,5,(ttch****),채리새우 A,으아아 그림체 넘 힐링 이다 ㅠㅠ 몽실몽실하고빨간 머리 앤 에 나오는 앤 느낌 나요 동화같다:D,2020-08-18 10:31,2,2
4365,드로잉 레시피,5,(stil****),007,아 재밌다 제발 남자2명이 여자하나 좋아하는 스토리만아니기를,2020-08-18 10:31,2,2
4366,드로잉 레시피,5,(93li****),비비,난 엄마랑 얘기하는 과거 기억이 괜히 슬프고 와닿아서 울컥했는대 마지막 뜬금포가 와닿는다는 사람도 있네ㅋㅋ 신기,2020-08-18 10:31,2,2
4367,드로잉 레시피,5,(mari****),도담다담,힐링 웹툰..,2020-08-18 10:31,2,2
4368,드로잉 레시피,5,(wend****),종려나무,어머니가 말씀을 너무 예쁘게 하세요ㅠ♡ 은수가 맛있게 먹으면 완성되는 그림이라니 ㅜㅜ,2020-08-18 10:31,2,2
4369,드로잉 레시피,5,(yeow****),여울이,"홍차리브레보다 더 재밌네여..ㅠㅠ 멋지다이 잔잔함.. 그리고 속상한일상..거창한 결단이나 비장함 말고, 그냥 일상을 살아가여 해결해나가는 모습.. 거품없어 좋아요!",2020-08-18 10:31,2,2
4370,드로잉 레시피,5,(kmc1****),박이지,아 나는 돼지 그려져 있는 감자전 보고 침 삼킨 나는 돼지 못 참고 치킨 시킨 나는 돼지,2020-08-18 10:31,2,2
4371,드로잉 레시피,5,(youg****),자전거나그네,삼각관계...,2020-08-18 10:31,2,2
4372,드로잉 레시피,5,(jys_****),솜,마음이 답답할때 와서 보니까 절대 풀리지 않을것 같던 실뭉치들이 조금은 풀린기분이에요 아직 스토리는 어떨지 잘 모르겠지만 그림체가 몽글몽글하니 편안해져요 잘보고가요,2020-08-18 10:31,2,2
4373,드로잉 레시피,5,(p0p0****),에이블냥,여주 성격이 자기한테 피해주는 사람한테는 잘해주고 호의있는 사람에게는 차갑게 굴고 이상하네 ㅋㅋㅋㅋ,2020-08-18 10:31,2,2
4374,드로잉 레시피,5,(art4****),부드러운직선,여주 왜케 까칠해;; 그러나 세상엔 다양한 사람들이 있고 저는 작가님 웹툰이 좋습니다~~,2020-08-18 10:31,2,2
4375,드로잉 레시피,5,(soon****),고냥이씨,마음이 편해지는 그림입니다. 웹툰 잘 안보는데 동화같은 그림이 끌리게 만드네요. 감사합니다. 보면서 마음정화할께요^^,2020-08-18 10:31,2,2
4376,드로잉 레시피,5,(kmag****),마리,너무 힐링돼고 조은데 댓글이없네요..의대남과 요섹남의 이야기 기대돼요..ㅎㅎ주인공이 어머니 회상하며 치유해가는 장면도 너무좋구요♥,2020-08-18 10:31,2,2
4377,드로잉 레시피,5,(ksy_****),,"역시ㅠㅠ 작가님의 머리속의 생각은 어디서 나오는건가요ㅠㅠ 홍차리브레도 읽으면서 마음에 와닿는게 너무 많았는데, 이번 작품도 제 마음을 막 몽글몽글하게 만드시다니...만약에 단행본이 나오게 된다면..사야겠다고 마음을 먹어봅니다😌😌😌",2020-08-18 10:31,2,2
4378,드로잉 레시피,5,(coyu****),윤초원,뭔가 리틀포레스트 느낌 잔잔하니 너무 좋다,2020-08-17 19:22,3,0
4379,드로잉 레시피,5,(meyo****),찐찐,잔잔한 꽃향기같은. 그림과 이야기. 좋타~~,2020-08-17 19:22,3,0
4380,드로잉 레시피,5,(na2s****),na2,어 이거 실화 아니였낭,2020-08-17 19:22,3,0
4381,드로잉 레시피,5,(rick****),dkwkdkwk,여주가 까칠한 이유가 엄마가 돌아가신 것 때문이 아닐까해요,2020-08-17 19:22,3,0
4382,드로잉 레시피,5,(laur****),세리,싫어요충 ㅋㅎㅋㅎ,2020-08-17 19:22,3,0
4383,드로잉 레시피,5,(laur****),세리,와 너무 재밌어요..,2020-08-17 19:22,3,0
4384,드로잉 레시피,5,(zx26****),꽁뜨,좋은 작품앞에서 주접떨고 싶지않은데 작가님은 대체 몇도로 세상살이 하시는거에요. 따뜻하다못해 뜨거워요ㅠㅜ다보고 나면 차한잔 다 마신 기분이에요👍,2020-08-17 19:22,3,0
4385,드로잉 레시피,5,(inoo****),서진,작가님 사랑해여,2020-08-17 19:22,3,0
4386,드로잉 레시피,5,(kjwk****),,아...진짜 완전 중독성 다음 이야기 빨리요!,2020-08-17 19:22,3,0
4387,드로잉 레시피,5,(heav****),멋진하루,하아...너무 재밌어. 너무 힐링돼. 최고야😍😍😍잔잔하게 이어져가는 스토리도 좋고 몽글몽글 소프트하고 귀여운 색감의 그림체도 좋고.. 꼬모소이 작가님 넘넘넘 좋아용☺,2020-08-17 19:22,3,0
4388,드로잉 레시피,5,(bule****),페르소나,작가님 작품 기다렸어요 다시 보게되서 좋아요,2020-08-17 19:22,3,0
4389,드로잉 레시피,5,(www7****),쥐뚱쥐뚱,넘 재밌어요 ♥♥♥,2020-08-17 19:22,3,0
4390,드로잉 레시피,5,(koom****),구블리,오늘 내용도 늘 그랬듯 참 좋았어요. 작가님♡ 감사합니다~,2020-08-17 19:22,3,0
4391,드로잉 레시피,5,(youn****),원더러스트,"작가님 몽글몽글 따뜻한 그림체나 내용에 담긴 메세지도 힐링되고 넘 좋은데 또 하나 좋은 점은, 그런 작품을 보는 독자들이 쓰는 거라 그런지 댓글들도 대부분 따뜻함♥",2020-08-17 19:22,3,0
4392,드로잉 레시피,5,(osa7****),익명,흰색티셔츠 남자 아까 버스에서 만난 사람 아니야..?,2020-08-17 19:22,3,0
4393,드로잉 레시피,5,(pota****),지마,어쩌면 저 엄마의 심정이 고스란히 전달되는듯한.. 멋진 웹툰입니다... 근데 아가야.. 의대는 다녀라 ㅜ,2020-08-17 12:42,4,1
4394,드로잉 레시피,5,(wltn****),꿍D,메인에서 그림체 보고 들어왔어요 응원합니다!,2020-08-17 12:42,4,1
4395,드로잉 레시피,5,(merr****),핑핑이,엄마가 젓가락으로 그린 그림... 웹툰 한 편이 하나의 짧은 드라마같다 ..,2020-08-17 12:42,4,1
4396,드로잉 레시피,5,(shzs****),키티,ㅁㅇㅁㅇ~,2020-08-17 12:42,4,1
4397,드로잉 레시피,5,(real****),좋은꿈,딸들은 밥먹일 때 저렇게까지 비위 맞추는 구나..,2020-08-17 12:42,4,1
4398,드로잉 레시피,5,(clet****),MJ 레이블,식탁위 그림은 결국 엄마의 그림이기도 이 두명의 식탁 위에 걸린 그림이기도 한 거네요 대박ㅜ,2020-08-17 12:42,4,1
4399,드로잉 레시피,5,(uhah****),우하하,엄마의 요리ㅜㅜㅜ 왜 눈물이,2020-08-17 12:42,4,1
4400,드로잉 레시피,5,(tart****),탈주기타,은수 너무 힘들어서 날카롭고 상대방 불편하게 만드는 말만 내뱉지마는 동물의 숲 주민같은 마을 사람들이 마음의 문 열릴 때까지 두드렸다가 기다렸다가 하겠네 ^_^,2020-08-17 12:42,4,1
4401,드로잉 레시피,5,(mins****),emily,여주 그렇게 나쁜 성격은 아닌데 피곤하니 예민하니 힘드니 말들이 많으시네ㅋㅋㅋ 자기는 뭐가 그렇게 관대한 사람이라고,2020-08-17 12:42,4,1
4402,드로잉 레시피,5,(07ch****),07c,음..이복동생 같은 건 아니겠죠. 아니라고 말해,2020-08-17 12:42,4,1
4403,드로잉 레시피,5,(idea****),,여주 성격으로 사회생활 힘들었겠다,2020-08-17 12:42,4,1
4404,드로잉 레시피,5,(jigo****),살아남기,그림체보고 익숙해서 들어와보았어요. 다시 뵙게 되서 반갑습니다. 작가님^^♡,2020-08-17 12:42,4,1
4405,드로잉 레시피,5,(fggt****),요한나,음식을 젓가락으로 그린 그림으로 표현하신거 너무 좋은 것 같아요ㅠㅜ,2020-08-17 12:42,4,1
4406,드로잉 레시피,5,(skfx****),HAIR,캬.. 첫 눈에 반하면 그렇군요... 멘트가 아니었어,2020-08-17 12:42,4,1
4407,드로잉 레시피,5,(kaga****),,여주가 너무 비관적이고 예민한 타입이라 첫눈에 반하시면 좀 곤란해지실듯.. 피곤한 타입이거든요,2020-08-17 12:42,4,1
4408,드로잉 레시피,5,(phj6****),차차,ㅜㅜ 넘 좋다,2020-08-17 04:34,3,0
4409,드로잉 레시피,5,(luna****),새콤달콤,엄마가 해주는 음식 먹는것도 그림의 완성......작가님 어머님이 이렇게 다정하셨나요? 저도 그런 엄마가 되어주고 싶네요...현실은 넘 힘들지만...,2020-08-17 04:34,3,0
4410,드로잉 레시피,5,(vide****),연어초밥,아 이것이 힐링 ㅠㅠ작가님 넘 좋아요,2020-08-17 04:34,3,0
4411,드로잉 레시피,5,(choc****),겁나여신,액자 속 사진 속의 그 홍합홍합홍합홍합,2020-08-17 04:34,3,0
4412,드로잉 레시피,5,(thgu****),깍,"우리 은수가 맛있게 먹으면 완성되는 그림,,,, 미쳤다",2020-08-17 04:34,3,0
4413,드로잉 레시피,5,(rlaa****),패트와 매트,스크롤 내리다가 보물 찾은 느낌,2020-08-17 04:34,3,0
4414,드로잉 레시피,5,(mini****),min,엄마가 돌아가신걸까.. 나만 아직도 어머니 어디가셨는지 모르나..,2020-08-17 04:34,3,0
4415,드로잉 레시피,5,(garo****),gar,여주 엄마 진짜 좋은 사람인 듯,2020-08-17 04:34,3,0
4416,드로잉 레시피,5,(oran****),rkthffls,여주인공 좀 싫은타입인듯,2020-08-17 04:34,3,0
4417,드로잉 레시피,5,(tmfr****),슬구,"어떻게 떼 쓰는 딸에게 저리도 지혜롭게 말할 수 있을까요? 저도 언젠가 자녀에게 지혜로운 엄마, 따뜻한 말을 할 수 있는 사람이 되고 싶네요. 따뜻한 웹툰 감사합니다:)",2020-08-17 04:34,3,0
4418,드로잉 레시피,5,(seda****),나,지난번 홍차리브레 때도 그림도 좋고 설정도 좋아서 이번에도 열심히 보고있는데요! 한가지 걸렸던 특징은 항상 주인공의 사고방식이 뭐랄까.. 너무 베베 꼬여서 일상생활 가능한가 싶을정도로 불편하긴 했어요ㅠㅠ 근데 이번 화에서도 그런게 팍 느껴지네요.. 저도 성격이 그렇게 호방하진 않고 꽤 예민한 편에 속하긴 하지만 사람들과의 관계에 있어선 그리 깊게 힘들어하지 않는 편이에요 많은 경험을 통해서 이렇게 바뀌게 된것이지만.. 마음을 좀 더 넓게 쉽게 긍정적으로 가지면 인생이 더 편할 것 같아요..! 오지랖이 길었네요.. ㅎㅎ 그래도 여타 다른 웹툰과는 차별되는 성격의 주인공이 만들어나가는 이야기라서 흥미롭게 잘보고있습니다 그림도 너무 예뻐요 !,2020-08-17 04:34,3,0
4419,드로잉 레시피,5,(lisi****),뽀짝,마지막 대사가 와닿네요.. 어디선가 본 듯 한게 아니라 그냥 첫 눈에 반한거라는게ㅎㅎ,2020-08-17 04:34,3,0
4420,드로잉 레시피,5,(tkeo****),오렌지,이야기가 진행될때마다 은수의 어머니가 계속 기억으로 등장하네요... 포근한데 뭔가 슬퍼요ㅠㅠ....,2020-08-17 04:34,3,0
4421,드로잉 레시피,5,(ghks****),오뉴,"유난히 힘들고 지치는 월요일, 드로잉 레시피 보면서 힘내고 갑니다ㅜㅜ",2020-08-17 04:34,3,0
4422,드로잉 레시피,5,(kgwb****),루이닐,어머?,2020-08-17 04:34,3,0
4423,드로잉 레시피,5,(yams****),조제,훌륭한 엄마네... 반성하고 갑니다 ㅠ,2020-08-17 00:22,3,0
4424,드로잉 레시피,5,(char****),김시은,하 진짜 지친 하루 속 한 줄기 빛같은 웹툰이에요ㅠ힐링도 되고 내용도 재밌는...보송보송하고 나른한 느낌이랄까..?포근한 느낌도 있구요!,2020-08-17 00:22,3,0
4425,드로잉 레시피,5,(www0****),물망초,작가님 ㅠㅠㅠ 작가님의 그림체는 사람을 참 몽실몽실하게 만드는 매력이 있지만 담고 있는 이야기는 결코 가볍지 않아서 좋아요.누구나 살면서 한번쯤은 했을또는 하게 될 수도 있는 그런 고민들을 담아 풀어내서작가님의 웹툰을 볼 때마다 어쩐지 위로받는 느낌이예요.좋은 작품 연재해주셔서 감사합니다.항상 잘 챙겨보고 있어요. 응원해요!!,2020-08-17 00:22,3,0
4426,드로잉 레시피,5,(soeu****),Dechocolate,엄마가 딸래미에게 한마디한마디 정말 다정하신 것 같아요어떤 속사정이 더 있었을지 궁금하네요,2020-08-17 00:22,3,0
4427,드로잉 레시피,5,(xdwd****),자하,삼각관곈데 형이 양보하고 동생과 여주가 다시 속세로 떠난다에내 쿠키10개를 걸지.,2020-08-17 00:22,3,0
4428,드로잉 레시피,5,(pack****),숲속,편안하게 볼 수 있는 웹툰이라 너무 좋아요~!,2020-08-17 00:22,3,0
4429,드로잉 레시피,5,(tytt****),므녜,엄마 너무 따뜻하다..,2020-08-17 00:22,3,0
4430,드로잉 레시피,5,(nokt****),아자아자,팜므파탈??? ㅋㅋㅋㅋ,2020-08-17 00:22,3,0
4431,드로잉 레시피,5,(majo****),정은혜,넘 따뜻해지는 기분,2020-08-17 00:22,3,0
4432,드로잉 레시피,5,(junn****),QQQQQQQQQ,스누피를 보는 듯한 힐링감이네요ㅎㅎ,2020-08-17 00:22,3,0
4433,드로잉 레시피,5,(byjb****),youn14,와 아예 10점 처음 본다,2020-08-17 00:22,3,0
4434,드로잉 레시피,5,(wyui****),김성희,너무 힐링되는 웹툰,2020-08-17 00:22,3,0
4435,드로잉 레시피,5,(namo****),현서,๑>ᴗ< ๑,2020-08-17 00:22,3,0
4436,드로잉 레시피,5,(hihi****),이동규,10점 ㄹㄱㄴ,2020-08-17 00:22,3,0
4437,드로잉 레시피,5,(min0****),민서,말랑콩떡 그림체쫀득쫀득 그림체,2020-08-17 00:22,3,0
4438,드로잉 레시피,5,(acte****),도리,이게 대충 그린 그림으로 보인다니.. 그림은 그려봤는지?,2020-08-16 23:21,5,0
4439,드로잉 레시피,5,(kuj6****),starlight,오호,2020-08-16 23:21,5,0
4440,드로잉 레시피,5,(blac****),bla,이런 걸 바로 힐링이라고 하는거구나,2020-08-16 23:21,5,0
4441,드로잉 레시피,5,(js76****),Sun,식탁위그림이 힌트였다니!,2020-08-16 23:21,5,0
4442,드로잉 레시피,5,(scal****),푸룬,남자 둘은 초상화 때문에 생긴 착각으로 뭔가 설레어하는 듯 하지만 .. 저 집에 왜 은수 엄마의 초상화가 있는 지가 주요 내용 중 하나일 거 같네요~,2020-08-16 23:21,5,0
4443,드로잉 레시피,5,(si19****),베이지,연애 스토리 안 나왔으면 좋겠다 주인공은 여주 한명이었으면,2020-08-16 23:21,5,0
4444,드로잉 레시피,5,(redb****),유아린,그럼 그 아저씨가 은수 아버지??,2020-08-16 23:21,5,0
4445,드로잉 레시피,5,(aj53****),안지희,어머머ㅓㅁ 삼각관계래!! 근데 저는 주인공이 자신의 길로 나아가는 내용만 있어도 사실 좋을 것 같아여,2020-08-16 23:21,5,0
4446,드로잉 레시피,5,(alsd****),농지,좋다 잔잔하고 설레고,2020-08-16 23:21,5,0
4447,드로잉 레시피,5,(dnfl****),박우림,아 설레요ㅠㅠㅠ,2020-08-16 23:21,5,0
4448,드로잉 레시피,5,(ear2****),파이리,ㅋㅋㅋ너무 재미있어요 1화 보고 울었다가 지금은 웃고있네요,2020-08-16 23:21,5,0
4449,드로잉 레시피,5,(nost****),ave,오..!!,2020-08-16 23:21,5,0
4450,드로잉 레시피,5,(g_on****),G1,당연히 어디서 본 듯 했을거에요..액자에서 맨날 보이던 여자분의 딸이었으니까..ㅎㅎ,2020-08-16 23:21,5,0
4451,드로잉 레시피,5,(lyod****),유정,뭔가 출생의비밀도 나올거 같다 여주의 아빠가 누구인지,2020-08-16 23:21,5,0
4452,드로잉 레시피,5,(lyod****),유정,삼각관계?,2020-08-16 23:21,5,0
4453,드로잉 레시피,5,(dmsq****),재욱은 나의 길,액자 속 여자가 엄마...?,2020-07-28 01:40,1242,6
4454,드로잉 레시피,5,(suhr****),서리,쿠키구워왔어요..남기지말아주세요..다음회차plzzzz,2020-07-28 01:40,1242,6
4455,드로잉 레시피,5,(wasp****),Waspy,진짜 너무재밌다,2020-07-28 01:40,1242,6
4456,드로잉 레시피,5,(xpdl****),아원한,이번 이야기도 제대로 힐링하겠습니다!!,2020-07-28 01:40,1242,6
4457,드로잉 레시피,5,(blue****),크류세,이렇게 인연이 시작되는군요💕,2020-07-28 01:40,1242,6
