,title,no,ID,nick,content,date,like,dislike
1562,드로잉 레시피,29,(kiky****),nonda,아 짜증나네 저런게 친구라고,2021-01-25 10:43,5,0
1563,드로잉 레시피,29,(fizz****),유지,결국은 은수가 진짜 미주가 가짜가 되어버렸네,2021-01-25 10:43,5,0
1564,드로잉 레시피,29,(empt****),Fraulee91,미ㅣ친 거 아냐,2021-01-25 10:43,5,0
1565,드로잉 레시피,29,(koom****),구블리,"아놔, 내 주변에 있던 저런 사람은 본인이 저랬다는걸 알까.... 모르겠지.",2021-01-25 10:43,5,0
1566,드로잉 레시피,29,(jdrh****),키위새,"잰 딱보니까 작품 훔친것도 여주탓 할 상이네, 결국 너때문에 내가 이렇게되고 여기까지 오게 됐다며 되려 뻔뻔한 자기입장 늘어놓을거 같아서 더 열받네 진짜!!!!!!!",2021-01-25 10:43,5,0
1567,드로잉 레시피,29,(pgha****),써니사이드업,답답해 ㅠㅠ 물러터진 은수ㅠㅠㅠㅠㅠㅠㅠㅠ내가 못된거지 ㅠㅠㅠㅠㅠㅠ후하,2021-01-11 23:27,3,0
1568,드로잉 레시피,29,(blue****),꿍,악 ㅋㅋㅋㅋ화나 쟤뭐야 은수야 머리채잡아 너그럴권한있어물론안하겠지너라면...ㄸㄹㄹㄹ,2021-01-11 23:27,3,0
1569,드로잉 레시피,29,(eaea****),남보미,진짜 재수없네..현실에 있을법해서 더 싫다,2021-01-11 23:27,3,0
1570,드로잉 레시피,29,(tpdu****),dusdl,제 반에 미주같은 애가 있어요 이름도 비슷하네요 . . 한 자를 빼다가 다른 곳에 붙이면 그 애 이름이네요 . . 진짜 성격이 비슷해요 . 특히 이기적인거 .,2021-01-11 23:27,3,0
1571,드로잉 레시피,29,(boob****),100,현실에 꼭 저런 사람이 있더라구요. 그만의 고충이 있을진 모르겠지만 당하는 입장에선 너무 힘든..,2021-01-11 23:27,3,0
1572,드로잉 레시피,29,(itis****),gloriouspond,미주에게 어떤 서사가 있을지 모르겠으나 내가 은수였다면 용서 못할 것 같다. 그냥 평생 마주치지 않고 생각하지 않으려하며 살겠지,2021-01-11 23:27,3,0
1573,드로잉 레시피,29,(past****),matilda,스스로 답이 없어서 왔을 듯. 그림 소재나 아이디어는 없고.. 자신에게 없는 재능 갖고 있던 은수는 부러웠고.. 꼭 소재를 얻기보다는 은수를 다시 보면 뭔가 달라질까 싶은.. 지푸라기라도 잡고 싶은 심정이었겠죠..,2021-01-11 23:27,3,0
1574,드로잉 레시피,29,(cydb****),버섯버,"미주가 은수를 정말 우월감없이 친구로서 좋아했던거라면 ""미대다니는 애가 짝퉁을 신는건 좀 아니지"" 를 부정해줬어야해요.",2021-01-11 23:27,3,0
1575,드로잉 레시피,29,(5845****),나이스,아 진짜 패고싶다 이미주.... 제발 이미주 망하는거 사이다로 보여주세요 작가님,2021-01-11 23:27,3,0
1576,드로잉 레시피,29,(wtd1****),,아직까지는 자세한 사정이 안나왔지만 미주가 (그림 베낀걸 제외하고서라도) 같이 지내면서 종종 일부러 그런건 아닐지 몰라도 주인공한테 상처준건 확실해 보이네요 신발도 왜 따라샀는지는 몰라도 무언가 잘못된 방식으로 자꾸 표현을 한 것 같아요,2021-01-11 23:27,3,0
1577,드로잉 레시피,29,(momi****),IamLove,미주가 은수를 동경해서 같은 신발을 샀을 수도 있다고 생각해요. 어렸을때부터 풍족하게 살아온 친구들이 그렇지 못한 사람들을 배려하지 못하는 것을 자주 봤는데 그런것이 아닐까 생각이 드네요. 물론 아닐수도 있지만... 은수 그림을 훔친것은 분명 잘못한 일이죠. 끝까지 이야기가 풀어지기 전까지 미주가 어떤 친구인지 알 수 없겠죠.,2021-01-11 23:27,3,0
1578,드로잉 레시피,29,(mysk****),jin,"하아... 웬만하면 이해하려 애쓰는데 미주는 진짜 밉상이네요ㅠㅠ은수야, 미주에게 신경 끊고 행복하자♡",2021-01-11 23:27,3,0
1579,드로잉 레시피,29,(meyo****),찐찐,자꾸!!!!!! 험한 말!!!!!!! 하구 싶씁니다!!!!!!현실에서도 저런 것들은 꼭! 있으니까요.아닌 척 은근히 남을 밟아놔야 직성이 풀리는 것들 말입니다!!! 꼭 저 것.을 깨끗이 치워주십씨오.,2021-01-11 23:27,3,0
1580,드로잉 레시피,29,(meyo****),찐찐,아예 너므 인생을 훔치려는군....걍~~ 꺼져라이,2021-01-11 23:27,3,0
1581,드로잉 레시피,29,(thdu****),호로록,꺼뎌줄래,2021-01-11 23:27,3,0
1582,드로잉 레시피,29,(dmsw****),우물쭈물,에휴 추하다 반전이고 뭐고 제발 저친구 나락으로 떨어지는 결말이길,2021-01-11 01:07,6,0
1583,드로잉 레시피,29,(alsl****),하얀악어,반짝반짝빛나는 사람을 보면 그렇게 되고싶어지는데 억지로 따라하려고 한다고해서 그반짝임이 옮아오는게 아닌데 저친구는 그걸모르고 정신없이 따라하다가 길을잃어버렸네요 돌아돌아 반짝임을 다시찾아왔지만 결국은 남만 따라하다가 자기는 놓쳐버린 초라한 자신의 행색만 확인하고 가겠네요,2021-01-11 01:07,6,0
1584,드로잉 레시피,29,(maya****),,다음 작품 쏘스 얻을려고 왔나?,2021-01-11 01:07,6,0
1585,드로잉 레시피,29,(mong****),아라,신발을 미주가 먼저 샀는지 뒤에 샀는지는 모르겠으나 참 묘하네미주 정말 우월감에 살았던거 같음은근히 즐기면서,2021-01-11 01:07,6,0
1586,드로잉 레시피,29,(gina****),GINA,"당연 소재 떨어졌으니, 노트 훔치러 온거 아닝가?",2021-01-11 01:07,6,0
1587,드로잉 레시피,29,(wowh****),병장,저 애는 대체 뭘 하려고 온 거야,2021-01-11 01:07,6,0
1588,드로잉 레시피,29,(wndu****),아리나,보고 스스로의 한심함을 깨달으라고.,2021-01-11 01:07,6,0
1589,드로잉 레시피,29,(rkdu****),ona,저는 미주가 더 돋보이려고 한다기보다 은수를 정말 좋아하고 은수가 하는게 예뻐보여서 비슷한 걸로 산거처럼 느껴지는데 그냥 평소 사던데에서(무려 어마어마한 가격의 명품...ㅋㅋㅋ) 최대한 비슷한 걸로 산게 아닐까 싶기도 해요.. 친구가 굳이 비교를 해서 은수가 좀 초라해지는 상황이 되긴 했지만 ㅠㅠㅠㅠ,2021-01-11 01:07,6,0
1590,드로잉 레시피,29,(ange****),amber,잘곳도 없고 대책없이 왜 찾아와서...잘못한 건 자기인데 왜 버리고 가냐고 징징 처음부터 끝까지 이기적,2021-01-11 01:07,6,0
1591,드로잉 레시피,29,(qkdl****),커피향,뭐 반전이 있는건가 했는데 그냥 재수없네...무슨 말이 하고 싶어서 뻔뻔하게 왔을까...,2021-01-11 01:07,6,0
1592,드로잉 레시피,29,(jyni****),리스,진짜 미주 어쩌라는건지 모르겠다,2021-01-11 01:07,6,0
1593,드로잉 레시피,29,(ohha****),,무슨 생각으로 왔는지....진짜 구두까지도 본인이 더 뛰어나다는걸 보여주려는 자기만 돋보이고 싶어하는 사람이네요.,2021-01-11 01:07,6,0
1594,드로잉 레시피,29,(dlwl****),mdlw1217,남의것을 따라해 얻은 행복은 절대 진짜가 될 수 없지 평생 불안해하며 살 수 밖에,2021-01-11 01:07,6,0
1595,드로잉 레시피,28,(best****),니타,뭐하는애냐..? 당신은 사이코패스입니다,1일 전,0,0
1596,드로잉 레시피,28,(penh****),돌쇠맘,악!!!!!!!열받!!!!,1일 전,0,0
1597,드로잉 레시피,28,(sige****),카이도,이미 선 먼저 넘은건 자기면서친구로 생각했다면 물어봤어야했다고?일을 그렇게 터트려놓고 물어봐야 대답할거였다는거야 뭐야화가난다 화가 나,1일 전,0,0
1598,드로잉 레시피,28,(dbdb****),애옹,와.... 저 미친......,1일 전,0,0
1599,드로잉 레시피,28,(sunm****),alstj,뻔뻔한 시키 왜 와서 갈곳이 없대 그럼 왜 왔어 지1랄하네,1일 전,0,0
1600,드로잉 레시피,28,(wet7****),Happy day,뻔뻔함이 하늘을 찌르네.적반하장도 유분수지ㅠ,1일 전,0,0
1601,드로잉 레시피,28,(heaz****),마린블루,..저뤈쓉..ㄴ.할-*,1일 전,0,0
1602,드로잉 레시피,28,(dhtk****),VMFHVLF,아. 나. 완 웹툰보면 욕 하긴 첨이네 두개의 연!!!!,1일 전,0,0
1603,드로잉 레시피,28,(yyye****),챈챈,죽여도 합법이다 ..,1일 전,0,0
1604,드로잉 레시피,28,(dmsc****),VV,"왜 자꾸 은수보고 피한다 어쩐다 하는지 모르겠음 아니 잘못한 사람이 따로있는데ㅋㅋㅋㅋ 꼭 잘못한 사람한테 적극적으로 맞서야하나? 영화나 드라마나 뭘 봐도 꼭 잘못한 사람이 상대한테 ""비겁하게 도망치기나 하고!"" 이런 장면 하나쯤은 있는데 진짜 ㅈㄴ 이해안가는 감성임... 똥이 더럽고 치사해서 피하는거라는 말도 있는데 왜 피해자가 문제를 대하는 태도를 가지고 왈가왈부하는건지 아오 진짜 답답해죽겠네 미주야 그냥 사라져 좀..",1일 전,0,0
1605,드로잉 레시피,28,(indi****),스카펑크,욕해도되요..아진짜,1일 전,0,0
1606,드로잉 레시피,28,(0112****),BongBong,( •́ ̯•̀ ) 뭐래,1일 전,0,0
1607,드로잉 레시피,28,(youn****),이서영,아진짜 화난다 영원히 재워주고싶은데 그건 안돼겠지...?,1일 전,0,0
1608,드로잉 레시피,28,(heej****),정이,하.... 신입생 술자리도 뭔가 주목 다 뺏는거같아서 기분이 별로인데?,1일 전,0,0
1609,드로잉 레시피,28,(smru****),Medicine Sigi,쟤는 무슨 낮짝으로.....,1일 전,0,0
1610,드로잉 레시피,28,(nue5****),정윤,"양심이 있으면 사과 먼저하고 친구가 저런 반응을 보이는걸 예상하고 갔을텐데, 그럼 두팔 벌려 반겨줄거라 기대하고 간건가? 아무리 사정이 있었다고 물어봐주길 바랬다한들, 먼저 통수친 ㄴ이 무릎꿇고 사정사정해야지ㅋㅋㅋ 주객전도 되었다는 생각은 안드나? 뻔뻔하네",2021-03-08 03:27,0,0
1611,드로잉 레시피,28,(km47****),민Min,나도 저런친구있음,2021-03-08 03:27,0,0
1612,드로잉 레시피,28,(cjss****),낭이,뭐냐.. 저 뻔뻔함은.. 남에 그림 베껴가 놓고 적반하장으로 화내고 이제는 재워달라는 거임..? ㄹㅇ 쟤는 머리에 뇌가 아닌 우동사리가 들어가있는 듯..,2021-03-08 03:27,0,0
1613,드로잉 레시피,28,(chec****),che,와..양심 1도 없네..ㄷㄷ 그렇게 막말 해놓고 잘곳 없으니까 재워주래...,2021-03-08 03:27,0,0
1614,드로잉 레시피,28,(naky****),이나경,어딜 기어들어와 그지깽깽이 ㅅ,2021-03-08 03:27,0,0
1615,드로잉 레시피,28,(nunu****),김석진,지가 잘못해놓고 왜 화풀이래,2021-03-08 03:27,0,0
1616,드로잉 레시피,28,(love****),월하아인,와 미친..진짜 육성으로 다들 욕..나도욕이 갑툭튀나오넹,2021-03-08 03:27,0,0
1617,드로잉 레시피,28,(haei****),abbi,뭔 미친 소리야 너야말로 친구로 생각했으면 그러지 말았어야지,2021-03-08 03:27,0,0
1618,드로잉 레시피,28,(kgr0****),kgr,주인공 작품을 다 그려버려서 또다른 작품 베끼려고 찾아온듯?,2021-03-08 03:27,0,0
1619,드로잉 레시피,28,(rics****),,그림훔쳐보러 온거냐!,2021-03-08 03:27,0,0
1620,드로잉 레시피,28,(apri****),박석박석,저새끼가진자,2021-03-08 03:27,0,0
1621,드로잉 레시피,28,(luna****),찌우찡,와 베댓님 ㄹㅇ 저랑 똑같은 생각... 저 도둑니은이 그림있는 방으로 가서 그림 훔칠까 걱정ㅠ,2021-03-08 03:27,0,0
1622,드로잉 레시피,28,(make****),써니,저 OOO 또 모 훔칠꺼 없나 왓나보네ㅡㅡ면상을 아주 찢어놔야 안훔치려나 OOO,2021-03-08 03:27,0,0
1623,드로잉 레시피,28,(anst****),M,정말 무슨 낯짝으로 저리 고개 빳빳세우며 말할수있는지 모르겠네요,2021-03-08 03:27,0,0
1624,드로잉 레시피,28,(nunk****),할라피뇨개존맛탱,와 미주야 뒤질래??,2021-03-08 03:27,0,0
1625,드로잉 레시피,28,(yeso****),EJ,무슨 낯짝으로 니가 와ㅓ!!!!!!!!,2021-01-29 22:48,4,0
1626,드로잉 레시피,28,(jach****),,ㅗㅜㅑ 미주인성 뭐야,2021-01-29 22:48,4,0
1627,드로잉 레시피,28,(elsa****),AnonymousCat,아니 무슨 염치로???,2021-01-29 22:48,4,0
1628,드로잉 레시피,28,(kimy****),감독,잘 곳도 없고 염치도 없네?,2021-01-29 22:48,4,0
1629,드로잉 레시피,28,(aje1****),JE,여기서도 도둑이더뻔뻔하네ㅡㅡ,2021-01-29 22:48,4,0
1630,드로잉 레시피,28,(yhwo****),al,미친..건가?,2021-01-29 22:48,4,0
1631,드로잉 레시피,28,(yewo****),예원,아ㅎㅋ 저또라이 저거ㅋㅋㅌㅋㅌㅌㅌㅌㅌㅌㅋㅋㅋㅋㅋㅋㅋㅋㅋㅋㅋㅋㅋ,2021-01-29 22:48,4,0
1632,드로잉 레시피,28,(syn6****),나,염치없네,2021-01-29 22:48,4,0
1633,드로잉 레시피,28,(casa****),시니컬,어떻게든 은수집으로 들어가야 자신이 은수에게서 훔쳐 큰 명성을 얻게해준 바로 그 그림의 다음 연작을 또 훔쳐갈 수 있을테니 가짜가 진짜를 훔칠 기회를 순순히 포기할까요? 이미 은수로부터 들었던 그 그림에 대한 은수의 가치관과 생각을 마치 자신의 경험과 영감인양 거짓말로 언론에 떠들어댄터라 바닥까지 드러난 자기 진짜 실력으로는 결코 다음작품도 은수의 다음 가치관과 생각도 또 어떻게든 훔쳐내야 계속 가짜가 지금처럼 진짜 작가행세를 이어나갈 수 있을테니 절실하겠죠. 당장 그 남자에게 은수 친구라고 거짓말을 해서 은수가 일하는 학원위치를 알아내 어떻게든 은수집에 들어가려고 할만큼 절박한 상황이니 몰래 은수의 집을 뒤져 다음작품을 폰으로 닥치는대로 찍어대고 또 은수에게 은수의 생각을 말하도록 유도해 그걸 또 폰으로 녹음해서 은수의 생각까지 훔쳐내야할테니ㅋ,2021-01-29 22:48,4,0
1634,드로잉 레시피,28,(cisl****),바다의빛,또 그림 훔치러 왔네.. 왜 뻔뻔한 사람들은 잘살까..피해자가 도망다니고...,2021-01-29 22:48,4,0
1635,드로잉 레시피,28,(drea****),권혜지,그림 소재가 떨어져서 온거지? 자기 그림이 아니니까 더이상 뭘 그릴 수 있을까! 친구라면 한 번은 물어봤어야했다고?? 친구라면 은수한테 그러면 안됐지!!!!!!,2021-01-29 22:48,4,0
1636,드로잉 레시피,28,(kair****),홍,그림 베끼러 온 건가 보네요...사람인가-_-,2021-01-29 22:48,4,0
1637,드로잉 레시피,28,(imbo****),나른해,이런 쌈싸먹을 베쥐터블!!!!,2021-01-29 22:48,4,0
1638,드로잉 레시피,28,(dhsm****),,보면 볼수록 너무 재밌네요,2021-01-29 22:48,4,0
1639,드로잉 레시피,28,(dbfl****),코튼,와 진짜 말하는 거봐 누가 누구한테 하는 말이냐 저게,2021-01-29 22:48,4,0
1640,드로잉 레시피,28,(anjf****),치노,또 그림 뺏어가는거 아냐??,2021-01-26 21:13,2,0
1641,드로잉 레시피,28,(qpal****),nouo,아니 ㅆ 근데 친구라면 물어봣어야지 ㅇㅈㄹ 하는거 그럼 넌 친구라면 말 햇어야지 michin아...,2021-01-26 21:13,2,0
1642,드로잉 레시피,28,(pian****),deo,저 ㅆ,2021-01-26 21:13,2,0
1643,드로잉 레시피,28,(leej****),lee,거절해!!!!!!!!!!,2021-01-26 21:13,2,0
1644,드로잉 레시피,28,(gywl****),아랑랑,이제 그림 다 떨어져서 또 훔치려고??,2021-01-26 21:13,2,0
1645,드로잉 레시피,28,(juhe****),키로군,아니 저년진짜 죽여버리고 싶은데요,2021-01-26 21:13,2,0
1646,드로잉 레시피,28,(pshe****),Sunny,왜케 내가 보는 웹툰들 여주는 하나같이 고구바 백개처먹은거 같냐 나였으면 이런일도 없겠지만 보자마자 개패고 내그림 도용한거 음성으로 인증할때까지 감금시킴 하 열받아,2021-01-26 21:13,2,0
1647,드로잉 레시피,28,(ddoi****),김도이,무슨 염치니,2021-01-26 21:13,2,0
1648,드로잉 레시피,28,(hbsi****),shb1,"은수가 피하는 건 맞는데 미주 지가 또 도망가는 거냐, 물어봤어야지 이런 말 할 처지는 아니지 않나?",2021-01-26 21:13,2,0
1649,드로잉 레시피,28,(boxi****),요요,화나요..ㅠㅠ 와......,2021-01-26 21:13,2,0
1650,드로잉 레시피,28,(rjsh****),rjs,너무 뻔뻔하다,2021-01-26 21:13,2,0
1651,드로잉 레시피,28,(gard****),dsstr,아닌데 그냥 보이는 거 말고 비하인드 스토리가 뭐가 있는 거같은데??,2021-01-26 21:13,2,0
1652,드로잉 레시피,28,(molr****),,물어봐달라고 도용했니 이관종아...,2021-01-26 21:13,2,0
1653,드로잉 레시피,28,(shin****),BHO,야이 X년아,2021-01-26 21:13,2,0
1654,드로잉 레시피,28,(shin****),라벤더,님 양심 ㅇㄷ?,2021-01-26 21:13,2,0
1655,드로잉 레시피,28,(salv****),이혜리,인중 때리고 싶다,2021-01-25 23:00,3,0
1656,드로잉 레시피,28,(www0****),whalien52,진짜 염치없네 ㅋㅋㅋㅋㅋ 저게 얼마나 화딱지나는 일인데. 내가 시간들여 공들여 머리돌려 애써서 만든 창작물을 곧이 곧대로 베껴서 남 좋은 일만 해준거잖아. 본인도 같은 직업 종사자라면 절대 용서받지 못할 일이란 걸 충분히 알 텐데 저러는거야? 미주 쟤가 하는 말 하나하나가 너무 개소리라 반박할 힘을 잃음.,2021-01-25 23:00,3,0
1657,드로잉 레시피,28,(lamb****),이하민,하 진짜 쟤 짜증난다 눈치도 없고 뻔뻔하네,2021-01-25 23:00,3,0
1658,드로잉 레시피,28,(miju****),mij,아 제 이름이 미주인데 미주가 너무 싫어요 아 뻔뻔해 미주 진짜,2021-01-25 23:00,3,0
1659,드로잉 레시피,28,(kssu****),악마,아니 훔쳐놓고 원작자에게 왜 그랬냐고 안 물어봤냐고?? 어떻게 된 사고방식이지?? 와서 변명에 온갖 핑계를 대면서 해명해도 모자랄 판에??,2021-01-25 23:00,3,0
1660,드로잉 레시피,28,(pgs0****),Bliss,뭐임?,2021-01-25 23:00,3,0
1661,드로잉 레시피,28,(ryin****),량우,우와 저노랑머리 진짜 뻔뻔하다,2021-01-25 23:00,3,0
1662,드로잉 레시피,28,(paca****),VanillaSky,하하..😀 이 ㅁlㅊl인..늬언이......,2021-01-25 23:00,3,0
1663,드로잉 레시피,28,(les3****),얼굴 빨개지는 아이,미주알 고주알,2021-01-25 23:00,3,0
1664,드로잉 레시피,28,(yeon****),Madame L,소재 다 떨어지니까 그림 훔치러 온 거 같은데.,2021-01-25 23:00,3,0
1665,드로잉 레시피,28,(skyo****),,일부러 집에가서 또 베끼려고 늦게 찾아온건가?,2021-01-25 23:00,3,0
1666,드로잉 레시피,28,(risa****),요커,????????????? 그림 베낀 거 따지지도 않았으니 친구로 생각 안했다는 거야????????뭔 개똥논리????????????? 이럴 때 은수가 말했어야죠....남의 꺼 훔친 거 자체가 친구 아니라고 통보한거 아니냐고 왜 내가 굳이 도둑이랑 말 섞어야냐고ㅡㅡ 아오 진짜 내 중딩때 부터 이어진 악연 생각나서 개 빡쳐 걔도 남의꺼 뺏어놓고 사과도 안하고 지가 무슨 매력쩌는 드라마 속 퀸이나 된거 마냥 개소리하던데 명치 사망 직전까지 쎄게 때리고 싶...,2021-01-25 23:00,3,0
1667,드로잉 레시피,28,(gree****),녹차,집에 작품있을까봐 아이디어 가지러 가는거 아냐..? 너무 불안하다...;;;,2021-01-25 23:00,3,0
1668,드로잉 레시피,28,(zihi****),에리키넌,참나. 그러는 너년은 친구라고 생각해서 그림 호로록 표절해 잡수셨어요?,2021-01-25 23:00,3,0
1669,드로잉 레시피,28,(cogu****),,와... 뻔뻔하다,2021-01-25 23:00,3,0
1670,드로잉 레시피,28,(eyyu****),앵,몬소리야 ???? 무슨 사연이있는데 저래 ????욕할뻔했다진짜 와우우 ㅆ!!!!,2021-01-25 18:28,2,0
1671,드로잉 레시피,28,(mikr****),너는 나의 지구,ㅁㅊ진짜 뻔뻔하다 뭘 잘했다고 저리 당당해,2021-01-25 18:28,2,0
1672,드로잉 레시피,28,(soze****),Seals,들어와서 홍차 한잔하고 가라고 해주고 싶네요.푸틴홍차 이ㄴ아!,2021-01-25 18:28,2,0
1673,드로잉 레시피,28,(rosi****),박시은,진짜 염치 없다,2021-01-25 18:28,2,0
1674,드로잉 레시피,28,(butc****),노블레스,뭔가 이유가 있다고 생각하고 싶습니다,2021-01-25 18:28,2,0
1675,드로잉 레시피,28,(angl****),,응 꼴찌툰 누가봄ㅋ,2021-01-25 18:28,2,0
1676,드로잉 레시피,28,(idw0****),나현주,쳐맞고싶은거임?,2021-01-25 18:28,2,0
1677,드로잉 레시피,28,(hjen****),,작가님을 믿습니다~ㅎㅎ,2021-01-25 18:28,2,0
1678,드로잉 레시피,28,(niki****),이아라,염치가 없구나 미주야.,2021-01-25 18:28,2,0
1679,드로잉 레시피,28,(6353****),beer,꼭 저런애들 있음 지가 잘못하면 잘못한거지 그러는 너도 문제있단식으로 몰아가는 애들..,2021-01-25 18:28,2,0
1680,드로잉 레시피,28,(naby****),어느하루,한번이라도 친구라 생각했으면 그런 짓은 하면 안되는 것.어떤 이유든 어떤 사정이든 절대,2021-01-25 18:28,2,0
1681,드로잉 레시피,28,(darl****),앨리스,아우..내가 좋아하는 월요일웹툰 다섯개가 약속이라도 한듯 고구마...아이구 열바다열바다 사이다좀 사먹어야겠당,2021-01-25 18:28,2,0
1682,드로잉 레시피,28,(joun****),뾰로롱,2×9=18,2021-01-25 18:28,2,0
1683,드로잉 레시피,28,(gily****),쩨,제발... 얼어죽든말든간에 놔두고 집가자!!! 재워주지마!!,2021-01-25 18:28,2,0
1684,드로잉 레시피,28,(hyen****),hye,이 웹툰은 단행본이 꼭 나왔으면 좋겠어요!,2021-01-25 18:28,2,0
1685,드로잉 레시피,28,(co21****),크런키,대박 미친거아닌지,2021-01-25 13:38,2,0
1686,드로잉 레시피,28,(syc1****),SYC,존나 가식이다,2021-01-25 13:38,2,0
1687,드로잉 레시피,28,(mshy****),없는 계정입니다,또 잔다면서 작품훔치고 튀면 뒤진다,2021-01-25 13:38,2,0
1688,드로잉 레시피,28,(atla****),함께 산다는 것,대체 어디 와서 적반하장 훈계질에 지적질에 머릴 들어 밀어?? 왜구질 그대로 쫒아하는 거냐?,2021-01-25 13:38,2,0
1689,드로잉 레시피,28,(yjs3****),정수,대체 무슨 뒷이야기가 있는것일꼬,2021-01-25 13:38,2,0
1690,드로잉 레시피,28,(lisu****),레이저,적반하장....,2021-01-25 13:38,2,0
1691,드로잉 레시피,28,(luo8****),토미랑,뭐..이런 뻔순이 같으니...,2021-01-25 13:38,2,0
1692,드로잉 레시피,28,(kgwb****),루이닐,뭐냐 쟤,2021-01-25 13:38,2,0
1693,드로잉 레시피,28,(ks60****),동백스,친구라고 하는데 가스라이팅이라고 아니??,2021-01-25 13:38,2,0
1694,드로잉 레시피,28,(lees****),병둥이,와.... 저 누런머리 진짜 뻔뻔하네...,2021-01-25 13:38,2,0
1695,드로잉 레시피,28,(cros****),클렙,저래놓고 핸폰으로 그림 찍어가려고 그러는거 아니겠죠?.... 와 노양심.....,2021-01-25 13:38,2,0
1696,드로잉 레시피,28,(no1n****),00,무슨 사연이 있든 친구라 생각했으면 네가 먼저 그러질 말았어야지! 도망은 무슨,2021-01-25 13:38,2,0
1697,드로잉 레시피,28,(yell****),알랑이,은수가 도망을 갔건 잠수를 탔건 그거랑 그림 베낀거랑은 별개잖아 이 뻔순아!!!!!!,2021-01-25 13:38,2,0
1698,드로잉 레시피,28,(yese****),소심한 관종,"와 육성으로 쌍욕이 나오네;; 아니 우리가 모르는 얘기가 있어도 쟤가 도용한 건 사실이고, 저작권법 위반인데 뭐라 저렇게.. 하 진짜 내가 저렇게 뻔뻔한 놈 처음 봤다. 적반하장도 적당해야지",2021-01-25 13:38,2,0
1699,드로잉 레시피,28,(shin****),앵덕어멈,아오 ㅁㅣ ㅊ ㅣㄴ ㄴ,2021-01-25 13:38,2,0
1700,드로잉 레시피,28,(0416****),김말랭,낯짝도 두껍지;;,2021-01-25 10:27,3,0
1701,드로잉 레시피,28,(lin5****),레몬소다,뭘 재워줘 막차타고 빨리 떠나,2021-01-25 10:27,3,0
1702,드로잉 레시피,28,(kimy****),꽃가루,고구마고구마해서 어떤느낌인가 했더니이런느낌이구나 아 숨막혀,2021-01-25 10:27,3,0
1703,드로잉 레시피,28,(art4****),부드러운직선,도둑냔이 뻔뻔하네,2021-01-25 10:27,3,0
1704,드로잉 레시피,28,(bny2****),꼬마건물주,염치 무엇 ..,2021-01-25 10:27,3,0
1705,드로잉 레시피,28,(ey0o****),써니,".........? 미친거 아니냐,.,,,,,,,,,, 미주년 진짜 뻔뻔하네...?",2021-01-25 10:27,3,0
1706,드로잉 레시피,28,(clas****),ivory,저 애는 멘탈이 장난 아님. 자기 필요성에 의해서 어떤 짓도 하는 사패. 사람 심리를 이용하는 악마적 재능이 있는 애인데 제발 집안에 들이지 말자.,2021-01-25 10:27,3,0
1707,드로잉 레시피,28,(exno****),놀레기,와 고구마 백개 먹은 기분이예요담회에 사이다 꼭꼭꼭 부탁드려요,2021-01-25 10:27,3,0
1708,드로잉 레시피,28,(chae****),akasb,"뭐야 왜 적반하장이야, 말 않통하네저거",2021-01-25 10:27,3,0
1709,드로잉 레시피,28,(atns****),atn,그래서 뭘 어쩌라고..길바닥에서 주무세요..,2021-01-25 10:27,3,0
1710,드로잉 레시피,28,(aoin****),추츄,뭐 저런 ㄴ이...,2021-01-25 10:27,3,0
1711,드로잉 레시피,28,(hdb4****),hdb,와 저렇게 당당한거 뭐임,2021-01-25 10:27,3,0
1712,드로잉 레시피,28,(xxx3****),보름이,내 대학동기같네 뻔뻔하게 휴학중에 학교와선 잘곳없다고 너가 혼자사니까 자기좀 재워달라고...ㅋ 너가 내 팀 사람들 다 뺏어가려고 했으면서 철면피들은 뭐가 그렇게 당당한지 참나,2021-01-25 10:27,3,0
1713,드로잉 레시피,28,(hj90****),우뿌,진짜 뻔뻔스러운게 지나치다,2021-01-25 10:27,3,0
1714,드로잉 레시피,28,(indi****),달빛마녀,하!!! 개 뻔뻔하네. 사람 이상하게 몰아간 것도 마음에 안 드는 도둑X이....착한 척하는 것이 가증스럽군.,2021-01-25 10:27,3,0
