,title,no,ID,nick,content,date,like,dislike
3003,드로잉 레시피,17,(seon****),보리꼬리z,"모두의 어린시절이 행복한 기억들로만 남겨지면 좋겠어요.. 작은 가시에도 큰 흉터가 생길만큼 크게 상처받고, 어린만큼 많이 아파하고, 그런 일들이 아예 생겨나지 않았으면 해요. 좋지만은 않았던 그때의 기억으로 살아간다든건 어쩔때는 고문같이 느껴져서ㅠㅠ",2일 전,0,0
3004,드로잉 레시피,17,(rhgu****),오도방구부릉부릉,나다,2일 전,0,0
3005,드로잉 레시피,17,(kjhe****),무달경규,사람들 다 누구나 저마다의 힘듦을 안고 사네요,2일 전,0,0
3006,드로잉 레시피,17,(44tk****),쭈,맘이 몽글 뭉클해지는 웹툰 흐잉따땃해,2일 전,0,0
3007,드로잉 레시피,17,(siaw****),flava,포카리 채도가 전체 분위기와 대조되게 너무 강해서 매우 시원해보이네요 포카리 마시고싶다,2일 전,0,0
3008,드로잉 레시피,17,(neve****),호석이두마리치킨직원,엄마가 곁에 없는 것도 힘들고 가족이 있어도 힘이 되지 못한다는 것도 힘들고 가족이 있어도 가족의 역할 같은 부분을 제대로 받지 못한다면 가족이 있다고 해도 힘든건 여전할 거 같다는 걸 느껴요 ...,2일 전,0,0
3009,드로잉 레시피,17,(minj****),강민지,( ˃̣̣̥᷄⌓˂̣̣̥᷅ ),2020-11-17 04:29,2,0
3010,드로잉 레시피,17,(wlsi****),ㅇㅅㅇ,베댓도 맞는 말이다... 색칠은 내가 하는 거지 근데 밑그림이 그지 같은데 색칠을 잘 한다고 예쁜 그림이 될까?,2020-11-17 04:29,2,0
3011,드로잉 레시피,17,(wlsi****),ㅇㅅㅇ,맞음... 어렸을 땐 내가 어떻게 할 수도 없는 거라... 안 그래도 엄마한테 욕 먹고 어렸을 때 학대 받았던 기억이 잠깐 떠올랐는데 이거 보니까 진짜 눈물이 안 멈춘다,2020-11-17 04:29,2,0
3012,드로잉 레시피,17,(dmst****),비쥬IY,너무 공감되는 대사네요..행복한 배경에서 커서 어른이 되는 사람들이 부럽다는말...,2020-11-17 04:29,2,0
3013,드로잉 레시피,17,(poog****),Yu,행복한기억을가지고어른이된사람만큼부러운게없어..,2020-11-17 04:29,2,0
3014,드로잉 레시피,17,(kimm****),김만두,문득 가슴이 아프네요,2020-11-17 04:29,2,0
3015,드로잉 레시피,17,(lyj3****),쨀,그렇네요 어린시절은 내가 어떻게 할 수도 없던 일들인데 커서도 무슨일을 할때 꼭 한번씩 생각하고 발목을 잡을때가 있는것 같아요.,2020-11-17 04:29,2,0
3016,드로잉 레시피,17,(yell****),알랑이,"와... 종훈이말... 새삼 충격스럽다... 내 잘못이나 내탓이 아닌 행복하거나 불행하거나 했을 어린시절... 본인이 선택하고 본인이 노력할수있는 최대한을 해봤자 어린아이가 그안에서 할수있는 노력이나 선택은 정말 미미하고 한계가 있지만, 그들에게 행복감과 불행함을 안겨줄수있는 어른들의 언행과 처사는 너무나 잔혹하고 절대적인 시절... 그리고 지금의 내가 아무리 부유하고 권력과 능력이 있다고 한들 절대 바꿀수 없는 그시절...",2020-11-17 04:29,2,0
3017,드로잉 레시피,17,(haed****),씨앗에 소망을 담고,종훈 말이 너무나도 마음속 깊이 공감돼요ㅠ,2020-11-17 04:29,2,0
3018,드로잉 레시피,17,(opwq****),,좋다,2020-11-17 04:29,2,0
3019,드로잉 레시피,17,(cher****),갱블리,역대급 대사다..,2020-11-17 04:29,2,0
3020,드로잉 레시피,17,(zihi****),에리키넌,다 팔자다.그냥 지금이 젤 중요하지.정신건강 챙기고 살려면그런 옛날 다 팔자거니 넘기는 게 최고.안 그럼 많이 힘듦.,2020-11-17 04:29,2,0
3021,드로잉 레시피,17,(idw0****),나현주,맞는말이네요..,2020-11-17 04:29,2,0
3022,드로잉 레시피,17,(youg****),자전거나그네,아이고.,2020-11-17 04:29,2,0
3023,드로잉 레시피,17,(rkda****),KMH,이번화는....정말먼가...마음에 응어리짓듯 와닿은 편인것같아요......모두힘내세요....,2020-11-17 04:29,2,0
3024,드로잉 레시피,17,(chri****),Sue,넘 공감되요 종훈이의 대사가 좋은 어린시절의 추억은 정말 커서 큰 힘이 되는거 같아요,2020-11-10 13:13,3,0
3025,드로잉 레시피,17,(dest****),,대사 한마디 마디마다 눈물이 나네요..제 맘도 많이 힘들다는걸 느꼈습니다..,2020-11-10 13:13,3,0
3026,드로잉 레시피,17,(sens****),SD,넘 뭉클 ㅠㅠ,2020-11-10 13:13,3,0
3027,드로잉 레시피,17,(jge8****),하니,"내 탓이 아닌데 평생을 짊어져야 하는것. 정말 눈물나요. 언제까지 그 시절에 목매여 있을까요. 이십년도 더 지난일인데 떠올리는것 만으로도 눈물이 나고 유사한 상황에서도 눈물 참느라 바빠요. 상처가 낫지를 않아요. 내 잘못이 아닌데 이제까지 안고있다는것 자체로 내 잘못이 됐어요. 성인이 되서 부모탓 하는것 만큼 한심한거 없다는 말, 인정하면서도 슬퍼요. 내가 그런 사람이라서요. 떠올리는것만으로도 눈물이 쏟아지는데 안고있는것 만으로도 내탓이 되버렸어요",2020-11-10 13:13,3,0
3028,드로잉 레시피,17,(kiwy****),귀 바알간 도우니,유기불안 검색해보세요.이종훈 캐릭터 보니 생각나네요.저도 극복해야하는데.ㅎ,2020-11-10 13:13,3,0
3029,드로잉 레시피,17,(hith****),2013,아 근데 주인공 항상 표정도 어둡고 머리스타일도 답답함.. ㅠㅠ 주인공한테 공감이 돼야 챙겨볼텐데 매 화 어딘가 우중충하게 일침날리는 여주 행동이 너무 마이너해서 아쉬워요 그림이랑 너무 딴판이기도 하고 기대햇던거랑 너무 다르네요,2020-11-10 13:13,3,0
3030,드로잉 레시피,17,(seun****),alrang,마음이 따수워요...,2020-11-10 13:13,3,0
3031,드로잉 레시피,17,(immv****),비밀이야,은수는 너무 어둠이 짙게 깔려있어요 하지만 어린시절 만큼은 그 누구에게도 지지않을만큼 행복했었나 봐요 계속 봐왔지만 참 감동적이에요 늘 눈물이 먼저나요 멋진 이야기들이 하나하나 자신에 역할로 충실하며.... 정말 멋진 이야기예요 앞날을 응원해요,2020-11-10 13:13,3,0
3032,드로잉 레시피,17,(emil****),너는적재나는적자,마음이 아파요..,2020-11-10 13:13,3,0
3033,드로잉 레시피,17,(kuj6****),starlight,"여운 남는 웹툰은 네이버에서 몇 안되는데, 이 작품은 자극적 내용 없이도 여운이 오래오래 가는 유일한 작품이에요. 오늘도 잘 봤습니다.",2020-11-10 13:13,3,0
3034,드로잉 레시피,17,(art4****),부드러운직선,어린 시절이 행복했던 사람...!,2020-11-10 13:13,3,0
3035,드로잉 레시피,17,(yov1****),Felicita,감사할게 없다고 불평했던 저를 돌아보게 되네요..,2020-11-10 13:13,3,0
3036,드로잉 레시피,17,(skyl****),바니,종훈이 지난 주 은상받을때 와주셨던 분들은 누구실까?,2020-11-10 13:13,3,0
3037,드로잉 레시피,17,(muse****),vanillalala,종훈이의 한마디 한마디가 너무나 와닿는다.. ㅜ,2020-11-10 13:13,3,0
3038,드로잉 레시피,17,(wjda****),미리미리,예비 유아교사로서 종훈이의 말이 가슴에 와닿네요,2020-11-10 13:13,3,0
3039,드로잉 레시피,17,(jaln****),이니,앞으로 태어날 우리 아이들에게 넘 필요한 말이네요. 유년시절 행복한 기억은 든든한 거름이 되고 자존감도 높아지죠.. 힘든일이 있어도 다시 일어날 수 있는 힘. 저도 아이에게 그런걸 물려주고 싶네요 좋은 내용~ 좋은그림 너무 감사합니다~~~~~,2020-11-09 17:48,2,0
3040,드로잉 레시피,17,(happ****),까꿍,저도 앞으로의 나..잘 예쁘게 칠해볼래요:)♡감사합니다 작가님!!,2020-11-09 17:48,2,0
3041,드로잉 레시피,17,(elyn****),공감요정,오늘 화는 너무 공감이 가네요... 어린시절의 성장과정이 한 사람에게 미치는 영향이 얼마나 큰지를 알기에 ㅠㅠ 엄마에게 크게 사랑받았던 은수는 정말 행복한 사람이라는 생각이 들어요.,2020-11-09 17:48,2,0
3042,드로잉 레시피,17,(ging****),진저,"제 고민이에요. 초등학교 4학년 이전의 기억이 제게 없어요. 항상 싸우던 아빠와 엄마, 그 안에 추억은 단 하나도 없더라구요.. 그저 파편화된 채로 언니들에 대한 기억밖에 없고 대개 지금의 절 만들어 주는 기억들은 부모님이 들어있지 않아요. 그래서 요즘 항상 SNS를 볼 때마다 친구들의 성공, 돈 이런 과시에도 단 한번도 부러운 적이 없었는데 안정된 가정으로부터 행복한 기억을 지닌채 어른으로 성장한 친구들을 보면 너무 부럽더라구요.. 나는 절대 갖지 못하는 그 무엇이니까.. 그 결핍을 어떻게 채워야 할 지 감도 안잡히네요.",2020-11-09 17:48,2,0
3043,드로잉 레시피,17,(sove****),남우,내탓이아닌데 평생내가짊어지고가야하는거..어린시절.너무와닿네요.감사합니다.괜찮다고 위로받는 기분이에요!,2020-11-09 17:48,2,0
3044,드로잉 레시피,17,(yese****),슬리데린,여기에 나오는 인물이 다 슬픈 경험이 있네요.. 다 치유됬으면..,2020-11-09 17:48,2,0
3045,드로잉 레시피,17,(sexy****),,아 자식키우는데.. 잊고 있었던거... 이거 보고 다시 마음 가다듬습니다 감사합니다 작가님....,2020-11-09 17:48,2,0
3046,드로잉 레시피,17,(end1****),친절한근자씨,"어린시절 불행하다 느낀적이 너무많았고, 내딸은 행복했노라고 하게 키우고싶은데 너무나 어렵다.",2020-11-09 17:48,2,0
3047,드로잉 레시피,17,(youn****),,많은나이는 아니지만 세상 살아보며 느낀게 어느집이나 사연없는집이 없더라구요..그냥 다들 행복해졌으면 좋겠어요..각자의 위치에서 각자가 할수있는 최선을 다하면서..! 우리 모두 다 행복해지자구요!! 그럴 자격이 충분히 있으니까요~*,2020-11-09 17:48,2,0
3048,드로잉 레시피,17,(1wkd****),Jjune,작가님 오늘 제 생일이에요. 멘탈이 털리고 가출해서 요즘 너무 힘든 채 맞은 생일이 전혀 기쁘지 않았는데....행복한 어린시절의 기억이 가득한 저는 행복해야해요. 맞죠...? 오늘 하루 행복하게 지낼게요. 감사합니다.,2020-11-09 17:48,2,0
3049,드로잉 레시피,17,(eien****),린여사,종훈이가 호구라서 굴러간거 아님??,2020-11-09 17:48,2,0
3050,드로잉 레시피,17,(mong****),,정말 많은 생각이 드는 회차네요... 유년 시절은 내가 어떻게 할 수 있던 것이 아니니까 하지만 가끔 그 시절이 생각나고 억울하고 하는데 공감하고 가요,2020-11-09 17:48,2,0
3051,드로잉 레시피,17,(eyyu****),앵,마음을 건드리는 작품이에여 ㅠ,2020-11-09 17:48,2,0
3052,드로잉 레시피,17,(aldu****),마요,종훈이 수상했을 때 오신 분들이 부모님이신 줄 알고 따뜻하고 행복하게 자란줄 알았는데 저런 아픔이 있었네요..,2020-11-09 17:48,2,0
3053,드로잉 레시피,17,(nara****),백설공주,어린시절 평범하게만 클 수 있는것만도 행복일것입니다.. 과거 부모로인해 행복하지 않았던 내삶이 현재도 늙은 그 부모로 인해 힘들다면...연을 끊어야할까요...내자식의 어린시절 할머니가 평범한 행복을 줄수 없다면말입니다.,2020-11-09 17:48,2,0
3054,드로잉 레시피,17,(27so****),시나몬교교주,죽어라 부모새끼야.,2020-11-09 05:42,1,0
3055,드로잉 레시피,17,(manh****),제리,냔학창시절이 너무지옥이였지만우리가족은 맨날싸웠지만엄마아빠가날 사랑해줘서 지금까지 잘지냈고잘컷고 부모님은 날있는그대로 봐주셨다부족하면부족한대로좋은남자만나서 결혼했고우리낙락이 엄마가나키운만큼이라도 꼭 키워야지부모님 감사드려요,2020-11-09 05:42,1,0
3056,드로잉 레시피,17,(kate****),lillil,고용관계란게 주어질 일을 하고 돈을 받는건데 게다가 저 쌤은 이미 자신을 과도하게 희생하고 있고만.. 학원이 무슨 은혜를 베풀어주는 곳도 아닌데 어케 자기가 민폐를 끼친다고 생각할 수 있지;; 어렸을 때 가스라이팅 당한게 성인이 되면 그렇게 이어질 수도 있는건가 ㅜ 짠하네 누구나 자기자신이 가장 중요해요!,2020-11-09 05:42,1,0
3057,드로잉 레시피,17,(paos****),서우진,"엄마는 멀쩡히 키워줬는데, 내가 다 망쳤다... 아오... 내 뱃살 어뜩해~~!!!",2020-11-09 05:42,1,0
3058,드로잉 레시피,17,(onbi****),,이웹툰 너무 좋아요... 작가님 오래오래 연재해주세요..♡,2020-11-09 05:42,1,0
3059,드로잉 레시피,17,(free****),cushion,다른 이가 날 알아주고 상처를 어루만져 주니 어찌 행복하지 않겠습니까....저런 사람 1명만 있어도 성공한 인생.,2020-11-09 05:42,1,0
3060,드로잉 레시피,17,(fnzk****),HS,꼬모소이님 작품은 슬프지만 따뜻하죠.. 그래요 밑바탕은 내가 어찌할 수 없었던 것이어도 앞으로의 나를 잘 채우고 칠하고 싶어요 그러려고 노력했고 지금도 부던히 노력하며 살아요 부러울 순 있지만 질투하거나 시기에 빠지진 않아요 나는 나고 그 사람은 그 사람이죠 자기를 지키면서 사는 종훈이가 되길 응원하게 되네요,2020-11-09 05:42,1,0
3061,드로잉 레시피,17,(tkde****),흰둥이,어린시절만 행복했다면 의미없는데..,2020-11-09 05:42,1,0
3062,드로잉 레시피,17,(baes****),난너무귀여오,엄마가ㅠㅠ 엄마가 바로 옆 방에 있는데도 보고싶다,2020-11-09 05:42,1,0
3063,드로잉 레시피,17,(csr8****),하쥬,나란 사람의 밑그림이 되지만 내가 어찌 할 수 없는 시기..이 대사에서 한참 멍 하니 정신이 멀어졌습니다밑그림이 미완성으로 자랐지만배경을 멋있게 만드려고 노력하고 있습니다저에게 있어서 작가님의 웹툰은 단순히 보는 만화를 떠나이 전 작품부터 한 마디 한마디가 소중한 컷 입니다감사합니다,2020-11-09 05:42,1,0
3064,드로잉 레시피,17,(wtj8****),달씨,너무 재밌습니다~,2020-11-09 05:42,1,0
3065,드로잉 레시피,17,(meyo****),찐찐,글고! 재수읎따..학원장??인지몬지... 긴 인생에 학원근무는 아주아주아주아주 잠깐일 뿐 이다. 직장때문에 학교를 관두라고??? 너므 인생이라고 함부로 내던지라는???,2020-11-09 05:42,1,0
3066,드로잉 레시피,17,(meyo****),찐찐,행복하지 않았던. 어린 시절이라도...지금의 내가 행복하고자하면 된다,2020-11-09 05:42,1,0
3067,드로잉 레시피,17,(skfx****),HAIR,멍해지네요..,2020-11-09 05:42,1,0
3068,드로잉 레시피,17,(kook****),mini쿠키,어린 시절이 그렇잖아. 나란 사람의 밑그림이 되지만 내가 어찌할 수 없는 시기. 내 탓이 아닌데... 평생 짊어지고 가야 하는거....,2020-11-09 05:42,1,0
3069,드로잉 레시피,17,(gngk****),삼색이,"그쵸ㅠ 어린시절, 나의 처음은 주변사람들이 밑그림을 그려줘야내가 크면서 완성할 수 있는건데... 완성하는데 부담이 없도록 좋은 밑그림을 그려주는 사람들이 있는 반면 밑그림은 커녕 도화지를찢어놓는 사람들이 있죠...",2020-11-09 00:34,3,0
3070,드로잉 레시피,17,(mi_h****),passing,"서로 닿지 않으면 마찰도 일어나지 않는다. 그게 내가 닳아없어지는 것 보다 낫다고 생각했다.. 우와,,, 작가님 진짜,, 오늘 명문장으로 새기고 갑니다. 오늘도 잘 봤어요🥰",2020-11-09 00:34,3,0
3071,드로잉 레시피,17,(0107****),띠링,너무너무 마음에 와닿는 화네요..,2020-11-09 00:34,3,0
3072,드로잉 레시피,17,(wnsi****),하늘여우,그림자가 울고 있는거에 울컥했네요..ㅜㅠ..,2020-11-09 00:34,3,0
3073,드로잉 레시피,17,(heej****),정이,"서로에게 좋은 존재네요,,",2020-11-09 00:34,3,0
3074,드로잉 레시피,17,(pean****),퇴끼양,대사와 배경 하나하나가 모두 따뜻하고 좋아요. 늘 좋은 그림 감사합니다 작가님. 제 월요일의 유일한 힐링이에요.,2020-11-09 00:34,3,0
3075,드로잉 레시피,17,(kath****),ㅇㅅㅇ,종훈이랑 같은 생각을 하고지냈는데 마지막 베댓 보고 깨달음을 얻었네요. 어린시절은 밑그림이니 색칠하는건 내 몫이라는것을요...,2020-11-09 00:34,3,0
3076,드로잉 레시피,17,(yiha****),나H,"""내 탓이 아닌데 평생 짊어지고 가야하는거...""라는 말이 정말 와닿네요ㅠㅠ더 이상 폭력으로든 언어로든 아동폭력은 하지 맙시다ㅠㅠㅠ",2020-11-09 00:34,3,0
3077,드로잉 레시피,17,(myst****),웅구리,맞아.. 행복한 유년시절을 보낸 사람만큼 부러운 사람은 없어요. 그 사람의 현재모습에 많은 영향을 끼치늑 밑바탕이 되니까. 그래서 더 악착같이 행복하려고 노력하게 되더라구요. 근데 작가님의 작품을 볼 때마다 그냥 몽글몽글한 감정이 굳이 행복하려고 노력하지 않아도 된다고 말해주는 것 같아요.,2020-11-09 00:34,3,0
3078,드로잉 레시피,17,(kraz****),꿀벌,우왕 저 원장 대가리 아그리파 상으로 깨버리고 싶네. 어디 가스라이팅이야.,2020-11-09 00:34,3,0
3079,드로잉 레시피,17,(lih3****),겉보리,"꼬모소이 작가께서 어떤 삶을 살아오셨는지 모르겠지만, 아무래도 곧 환갑을 바라보는 저보다 연하이실 것이 분명하겠지만, 사람을, 인생을, 관계를, 세상을 바라보는 눈은 훨씬 깊고 넓군요.",2020-11-09 00:34,3,0
3080,드로잉 레시피,17,(saeb****),sae,종훈이 어린시절 회상에서 그림자에 우는 묘사... 너무ㅠㅠ 너무...,2020-11-09 00:34,3,0
3081,드로잉 레시피,17,(91ri****),,저는 충분히 사랑받고 컸는데도 왤케 뭉클할까요. 작가님 제가 생각지못한것들을 일깨워주셔서 감사해요. 제 삶의 소중한 것들을 다시 자각하게 해주셔서 감사하구요. 항상 응원할게요💛,2020-11-09 00:34,3,0
3082,드로잉 레시피,17,(kimb****),시로이누,"와 베댓 공감... 슬픈데 따뜻해.,",2020-11-09 00:34,3,0
3083,드로잉 레시피,17,(myso****),,옆에 자고 있는 두 아이에게 행복한 어린시절을 만들어줘야겠단 생각이 드네요ㅜㅜ 소중한 하루하루,2020-11-09 00:34,3,0
3084,드로잉 레시피,17,(klol****),보노보노,어린시절...내가 어찌 할수 없는 시기.하지만 힘들고 어려웠던시절 지나고 살아남았다면 더 강해질수있다고 생각합니다. 트라우마는 남겠지만....자기잘못이 아니니 너무 자책하지 않기를.어릴때 환경은 내가 선택할수 없었을 테니까.주변에 힘을 주는말을 해주는 사람들이 있다면그나마 도움이 됩니다. 넌 할수 있어! 내가 응원할께! 이번엔 꼭 붙을꺼야!잘될꺼야! 그러니까 힘내! 아자!아자! 화이팅!!!,2020-11-08 23:37,2,0
3085,드로잉 레시피,17,(ohl3****),RIM,와 정주행 하고 있는데 작가님 표현력이 진짜 좋으세요,2020-11-08 23:37,2,0
3086,드로잉 레시피,17,(pret****),함뷰링,그리고 나의 쓸모..,2020-11-08 23:37,2,0
3087,드로잉 레시피,17,(codm****),뽀송,C- 넘모해...(대학생시점,2020-11-08 23:37,2,0
3088,드로잉 레시피,17,(kell****),명,종훈이한테 네부모님이 들으셨으면 서운하셨을거야 이말 진짜 화목한 가정에서 자란애가 공감못하고 해주는 도움안되는 조언같다...,2020-11-08 23:37,2,0
3089,드로잉 레시피,17,(pret****),함뷰링,내탓이 아닌데 평생 지고 가야 하는 것..,2020-11-08 23:37,2,0
3090,드로잉 레시피,17,(vbvb****),Devie,어린시절이 밑그림이다 라는말이 마음이 와 닿네요. 하지만 색칠은 현재 내 몫이니 더 잘 살아야겠네요....,2020-11-08 23:37,2,0
3091,드로잉 레시피,17,(bobo****),백 현,와 진짜 공감가는 말이네요.. 나란 사람의 밑그림이 되지만 내가 어찌할 순 없는 시기..,2020-11-08 23:37,2,0
3092,드로잉 레시피,17,(aizn****),으행행,어린시절이 내 밑그림이 된다는 말.. 말로 표현할수 없어서 잊을뻔 했는데 작가님 덕분에 유념하며 지내게 될 거 같아요ㅎㅎ,2020-11-08 23:37,2,0
3093,드로잉 레시피,17,(etoi****),newpage,가난했지만 부모님께 사랑받고 자란 저는 정말 행복한 사람인것 같아요. 오늘 화 너무 좋네요. 작가님 너무 좋아요~^^,2020-11-08 23:37,2,0
3094,드로잉 레시피,17,(kgwb****),루이닐,그렇네......,2020-11-08 23:37,2,0
3095,드로잉 레시피,17,(ssss****),봄비,저 소리 듣고 머리한대 맞은거같아요..내가 어찌할순 없지만 내가 평생 안고가야하는것..어린시절을 행복하게 보낸사람도 있지만 아닌 사람도 많다는거..여러분들 어린시절이 불행했다고 힘들지 않았으면 좋겠어요..앞으로의 인생은 행복하게 지냈으면 좋겠어요,2020-11-08 23:37,2,0
3096,드로잉 레시피,17,(xiah****),가린,별점 10점을 보았다는게 이런거구나.. 내가 좋아하는 웹툰이 10점이라니 뭔가 행복하다,2020-11-08 23:37,2,0
3097,드로잉 레시피,17,(pop7****),,행복한 기억을 가지고 어른이 된 사람.갖고 싶다고 가질 수 있는게 아닌 행운이네요 ^-^,2020-11-08 23:37,2,0
3098,드로잉 레시피,17,(cjik****),Jiin C,어린 종훈이의 울고 있는 그림자가...너무 아프네요.,2020-11-08 23:37,2,0
3099,드로잉 레시피,17,(koom****),구블리,ㅠㅠ,2020-10-26 02:01,3,0
3100,드로잉 레시피,17,(stap****),요암,은수의 마찰을 피하는 방법을 듣고 사회초년기때 생각나는데한창 스무살 초반 사람에게 데이고 남은 아무렇지 않은데 나만 상처입으니까 다른데가서는 사람에게 데이지 않으려고 잔뜩 긴장하면서 생활했던게 생각나네요조금가까워져도 어린동생이든 누구든 말 놓아본적 없었는데 그러다보니 자연스럽게 거리가생기고 벽이생기더라고요 그러다보면 정작 필요할때 사람이 없으니 고립되고 고립된 속에서 상처받더라고요,2020-10-26 02:01,3,0
3101,드로잉 레시피,17,(hbiw****),,격공,2020-10-26 02:01,3,0
3102,드로잉 레시피,17,(blue****),크류세,나는..내..아이에게 행복하고 잊지못할 어린시절을 만들어..주고..있는지..엄마의 무게가 더 묵직해지면서도 그런 시간들을 꾸며주고 싶은 마음이 가득해져요..먼훗날 내 아이에게 닥치는 현실이 버거워질때 어린시절을 생각하면서 미소지으며 다시 일어날수 있는 작은 힘이 되기를 바라면서요.,2020-10-26 02:01,3,0
3103,드로잉 레시피,17,(aaca****),메리골드,ㅠㅠㅠㅠ 전편들에서 은수 과거 회상 보면 얼마나 어머니에게 사랑받고 자랐는지 알 수 있죠. 뭉클하네요...,2020-10-26 02:01,3,0
3104,드로잉 레시피,17,(bory****),뱅뱅이,종훈이 맘이 제 맘이네요든든하게 사랑 받고 있는걸느끼면서 어린 시절을 보냈다면 좋았을걸 이라는 생각을 나이 들수록 하게되네요,2020-10-26 02:01,3,0
3105,드로잉 레시피,17,(lily****),,난 정말 엄마 아빠께 정말 감사드려야지ㅠㅠ 💗,2020-10-26 02:01,3,0
3106,드로잉 레시피,17,(j_ke****),실버문티,어린시절이 행복했든 아니든 커서는 다들 본인의 행복을 위한 삶을 살기를,2020-10-26 02:01,3,0
3107,드로잉 레시피,17,(coel****),피죤,아...ㅠㅠ,2020-10-26 02:01,3,0
3108,드로잉 레시피,17,(mong****),아라,우리 아들도 행복한 어린시절 기억했으면 좋겠네요,2020-10-26 02:01,3,0
3109,드로잉 레시피,17,(gjwj****),쨔아앙쿨,오늘 아이 재우는데.. 할머니가 항상 내 등 쓸어주면서 자장가 불러주며 재워주신 기억이 났는데 난 참 사랑 많이받고 자랐구나 생각했었는데... 전 너무 행복한 사람이네요🥰,2020-10-26 02:01,3,0
3110,드로잉 레시피,17,(tnal****),냠,작가님의 작품이 언제나 좋아요.,2020-10-26 02:01,3,0
3111,드로잉 레시피,17,(pure****),irene,꼬모소이님 작품은 슬픈 내용인데왜 따뜻해요,2020-10-26 02:01,3,0
3112,드로잉 레시피,17,(wosu****),웃쑤,ㅠㅠㅠ그냥 여기 있는 사람들 다 행복했음 좋겠다.. 은수가 부러워하던 종훈이도 가족이랑 안 좋고..ㅠㅡㅠㅠ.. 다들저마다 사연이 있는 것 같아 현실적이고 슬프네요. 다같이힘든 일 딛고 일어설수있으면ㅜ,2020-10-26 02:01,3,0
3113,드로잉 레시피,17,(m950****),스물여섯,너무 뭉클하네요ㅠㅠㅠㅜ 엄마가 내게 남겨준 것은 행복한 어린시절이었다...,2020-10-26 02:01,3,0
3114,드로잉 레시피,16,(love****),수빈,잉 ㅜ 산딸기꽃,2021-03-22 13:34,0,0
3115,드로잉 레시피,16,(tuna****),참치100마리,𓃘𓃝𓃗𓃠𓃩𓃡𓃟𓃬𓃰𓃱𓃯𓃵𓃹𓃷𓃲𓅜𓅪𓅰𓆉𓆈𓅭𓅦𓄿𓆌𓆗𓆟𓆏𓆣𓆧𓆦𓆡𓃘𓃝𓃗𓃠𓃩𓃡𓃟𓃬𓃰𓃱𓃯𓃵𓃹𓃷𓃲,2021-03-22 13:34,0,0
3116,드로잉 레시피,16,(sens****),Jiyoon,은수는 좀.. 남을 생각하는게 부족한 사람같다. 비단 어머니를 잃어서 남에게 상처받아서라기엔 그 전부터 부족해보인다.,2021-03-22 13:34,0,0
3117,드로잉 레시피,16,(yjyb****),뭐뭐무머ㅜ머ㅜ머,어매 느자구없는거,2021-03-22 13:34,0,0
